{
  "discovery_id": "00000000-0000-4000-8000-000000000020",
  "data_source_id": "00000000-0000-4000-8000-000000000007",
  "connector_id": "file_import",
  "entities": [
    {
      "entity": "sales.order_line",
      "source_name": "sotuvlar.csv",
      "match_score": 0.95,
      "columns": [
        "Hujjat ID",
        "Sana"
      ],
      "sample_rows": [
        [
          "S-1",
          "2026-08-01T10:00:00+05:00"
        ]
      ],
      "suggested_mapping": [
        {
          "canonical_field": "source_id",
          "source_column": "Hujjat ID",
          "transform": "text",
          "constant": null
        },
        {
          "canonical_field": "amount_includes_vat",
          "source_column": null,
          "transform": "const",
          "constant": "false"
        }
      ],
      "unmapped_required_fields": []
    }
  ],
  "error_code": null,
  "error_message": null
}
